{
  "generated_by": "architecture-knowledge-validation-kernel",
  "report": "lifecycle-distribution",
  "items": [
    {
      "state": "claim:proposed",
      "count": 8
    },
    {
      "state": "claim:sourced",
      "count": 74
    },
    {
      "state": "concept:drafted",
      "count": 20
    },
    {
      "state": "concept:proposed",
      "count": 4
    },
    {
      "state": "decision-guide:proposed",
      "count": 3
    },
    {
      "state": "relationship:proposed",
      "count": 4
    },
    {
      "state": "relationship:sourced",
      "count": 20
    },
    {
      "state": "source:approved",
      "count": 22
    }
  ],
  "summary": {
    "record_count": 155
  }
}
